{
  "$schema": "./config.schema.json",
  "version": 3,
  "ui_language": "en",
  "lamp_ip": "192.168.1.100",
  "expected_model": "yeelink.light.lamp22",
  "device_id": "123456789",
  "expected_mac": "",
  "location_name": "Your City",
  "latitude": 0.0,
  "longitude": 0.0,
  "elevation_meters": 0,
  "timezone": "UTC",
  "night_mode": true,
  "night_start": "sunset",
  "night_end": "sunrise",
  "night_start_offset_minutes": -20,
  "night_end_offset_minutes": 20,
  "wind_down_start": "23:30",
  "pre_sleep_start": "00:45",
  "bedtime": "01:45",
  "profile_transition_mode": "continuous",
  "profile_transition_ms": 700,
  "power_transition_ms": 0,
  "profile_brightness_tolerance": 1,
  "profile_kelvin_tolerance": 25,
  "light_profiles": {
    "evening": {
      "kelvin": 3000,
      "brightness": 35
    },
    "wind_down": {
      "kelvin": 2700,
      "brightness": 25
    },
    "pre_sleep": {
      "kelvin": 2700,
      "brightness": 15
    },
    "after_bedtime": {
      "kelvin": 2700,
      "brightness": 15
    },
    "manual_day": {
      "kelvin": 4000,
      "brightness": 45
    }
  },
  "manual_day_override_max_hours": 5,
  "manual_off_override_minutes": 120,
  "external_change_policy": "respect_until_next_profile",
  "external_change_respect_minutes": 60,
  "pause_until_tomorrow_time": "08:00",
  "sync_interval_seconds": 60,
  "network_change_poll_seconds": 10,
  "display_state_stale_minutes": 30,
  "unknown_display_policy": "off",
  "display_event_debounce_seconds": 2.0,
  "display_off_confirm_seconds": 5.0,
  "suppress_off_after_start_seconds": 10.0,
  "suppress_off_after_resume_seconds": 10.0,
  "respect_session_lock": true,
  "off_on_session_lock": true,
  "on_on_session_unlock": true,
  "respect_user_presence": true,
  "off_when_user_inactive": false,
  "ignore_remote_sessions": true,
  "service_prelogin_display": false,
  "network_wait_seconds_on": 20,
  "network_wait_seconds_off": 3,
  "network_wait_seconds_periodic": 3,
  "miio_timeout_seconds": 2.5,
  "miio_fast_timeout_seconds": 0.55,
  "suspend_off_timeout_seconds": 0.25,
  "suspend_event_deadline_seconds": 0.75,
  "retries": 2,
  "retry_delay_seconds": 1.0,
  "discovery_enabled": true,
  "discovery_neighbor_enabled": true,
  "discovery_mdns_seconds": 2.0,
  "discovery_scan_enabled": true,
  "discovery_scan_prefix": 24,
  "discovery_scan_workers": 16,
  "discovery_scan_timeout_seconds": 0.4,
  "discovery_cooldown_seconds": 300,
  "discovery_backoff_max_seconds": 1800,
  "discovery_full_scan_cooldown_seconds": 1800,
  "tray_enabled": true,
  "notifications_enabled": true,
  "notify_after_failure_seconds": 900,
  "event_log_enabled": true,
  "log_max_bytes": 5242880,
  "log_backup_count": 5
}
